fname,id,context,question,answer
Intrapartum care_Dr pronov.xlsx_Sheet1.docx,-1,বাড়ীতে প্রসব,যদি হাসপাতালে প্রসব না হয় তাহলে প্রশিক্ষণপ্রাপ্ত প্রসব সহায়তাকারীর প্রসব করানোর আগে প্রস্তুতি ধাপ গুল কী কি?,"{'fname': 'Intrapartum care_Dr pronov.xlsx_Sheet1.docx', 'id': -1, 'context': 'বাড়ীতে প্রসব', 'question': 'যদি হাসপাতালে প্রসব না হয় তাহলে প্রশিক্ষণপ্রাপ্ত প্রসব সহায়তাকারীর প্রসব করানোর আগে প্রস্তুতি ধাপ গুল কী কি?'}"
Others data - Sheet1.docx,18,অ্যাজমা বা হাঁপানি,অ্যাজমা বা হাঁপানি রোগ কি?,"{'fname': 'Others data - Sheet1.docx', 'id': 18, 'context': 'অ্যাজমা বা হাঁপানি', 'question': 'অ্যাজমা বা হাঁপানি রোগ কি?'}"
Others data - Sheet1.docx,19,অ্যাজমা বা হাঁপানি রোগের লক্ষণগুলো,অ্যাজমা বা হাঁপানি রোগের লক্ষণগুলো কী কী?,"{'fname': 'Others data - Sheet1.docx', 'id': 19, 'context': 'অ্যাজমা বা হাঁপানি রোগের লক্ষণগুলো', 'question': 'অ্যাজমা বা হাঁপানি রোগের লক্ষণগুলো কী কী?'}"
Others data - Sheet1.docx,20,অ্যাজমা হলে যখন  ডাক্তারের কাছে যেতে হবে,অ্যাজমা হলে কখন আপনি ডাক্তারের কাছে যাবেন?,"{'fname': 'Others data - Sheet1.docx', 'id': 20, 'context': 'অ্যাজমা হলে যখন  ডাক্তারের কাছে যেতে হবে', 'question': 'অ্যাজমা হলে কখন আপনি ডাক্তারের কাছে যাবেন?'}"
Others data - Sheet1.docx,21,হাঁপানি রোগের কারণসমূহ,হাঁপানি রোগের কারণসমূহ কী কী?,"{'fname': 'Others data - Sheet1.docx', 'id': 21, 'context': 'হাঁপানি রোগের কারণসমূহ', 'question': 'হাঁপানি রোগের কারণসমূহ কী কী?'}"
Others data - Sheet1.docx,22,হাঁপানি রোগের কারণসমূহ,হাঁপানি রোগের কারণসমূহ কী কী?,"{'fname': 'Others data - Sheet1.docx', 'id': 22, 'context': 'হাঁপানি রোগের কারণসমূহ', 'question': 'হাঁপানি রোগের কারণসমূহ কী কী?'}"
Others data - Sheet1.docx,23,অ্যাজমা অ্যাটাক,অ্যাজমা অ্যাটাক কি?,"{'fname': 'Others data - Sheet1.docx', 'id': 23, 'context': 'অ্যাজমা অ্যাটাক', 'question': 'অ্যাজমা অ্যাটাক কি?'}"
Others data - Sheet1.docx,24,অ্যাজমা অ্যাটাকের লক্ষণগুলো,অ্যাজমা অ্যাটাকের লক্ষণগুলো কী কী?,"{'fname': 'Others data - Sheet1.docx', 'id': 24, 'context': 'অ্যাজমা অ্যাটাকের লক্ষণগুলো', 'question': 'অ্যাজমা অ্যাটাকের লক্ষণগুলো কী কী?'}"
Others data - Sheet1.docx,25,অ্যাজমা অ্যাটাক হলে করণীয়,অ্যাজমা অ্যাটাক হলে করণীয় কী?,"{'fname': 'Others data - Sheet1.docx', 'id': 25, 'context': 'অ্যাজমা অ্যাটাক হলে করণীয়', 'question': 'অ্যাজমা অ্যাটাক হলে করণীয় কী?'}"
Others data - Sheet1.docx,26,অ্যাজমা অ্যাটাক হলে যখন ডাক্তারের কাছে যেতে হবে,অ্যাজমা অ্যাটাক হলে কখন দ্রুত হাসপাতালে যেতে হবে?,"{'fname': 'Others data - Sheet1.docx', 'id': 26, 'context': 'অ্যাজমা অ্যাটাক হলে যখন ডাক্তারের কাছে যেতে হবে', 'question': 'অ্যাজমা অ্যাটাক হলে কখন দ্রুত হাসপাতালে যেতে হবে?'}"
Others data - Sheet1.docx,27,অ্যাজমা অ্যাটাকের পরে   করণীয়,অ্যাজমা অ্যাটাকের পরে কী করণীয়?,"{'fname': 'Others data - Sheet1.docx', 'id': 27, 'context': 'অ্যাজমা অ্যাটাকের পরে   করণীয়', 'question': 'অ্যাজমা অ্যাটাকের পরে কী করণীয়?'}"
Others data - Sheet1.docx,28,অ্যাজমা অ্যাটাক প্রতিরোধ,কীভাবে অ্যাজমা অ্যাটাক প্রতিরোধ করা যায়?,"{'fname': 'Others data - Sheet1.docx', 'id': 28, 'context': 'অ্যাজমা অ্যাটাক প্রতিরোধ', 'question': 'কীভাবে অ্যাজমা অ্যাটাক প্রতিরোধ করা যায়?'}"
Others data - Sheet1.docx,29,অ্যাপেন্ডিসাইটিস,অ্যাপেন্ডিসাইটিস কি?,"{'fname': 'Others data - Sheet1.docx', 'id': 29, 'context': 'অ্যাপেন্ডিসাইটিস', 'question': 'অ্যাপেন্ডিসাইটিস কি?'}"
Others data - Sheet1.docx,30,অ্যাপেন্ডিসাইটিস এর লক্ষণ,অ্যাপেন্ডিসাইটিস এর লক্ষণ সমূহ কি?,"{'fname': 'Others data - Sheet1.docx', 'id': 30, 'context': 'অ্যাপেন্ডিসাইটিস এর লক্ষণ', 'question': 'অ্যাপেন্ডিসাইটিস এর লক্ষণ সমূহ কি?'}"
Others data - Sheet1.docx,31,অ্যাপেন্ডিসাইটিস যাদের  হয়,অ্যাপেন্ডিসাইটিস কাদের হয়?,"{'fname': 'Others data - Sheet1.docx', 'id': 31, 'context': 'অ্যাপেন্ডিসাইটিস যাদের  হয়', 'question': 'অ্যাপেন্ডিসাইটিস কাদের হয়?'}"
Others data - Sheet1.docx,32,অ্যাপেন্ডিসাইটিস হওয়ার কারণ,অ্যাপেন্ডিসাইটিস হওয়ার কারণ কি?,"{'fname': 'Others data - Sheet1.docx', 'id': 32, 'context': 'অ্যাপেন্ডিসাইটিস হওয়ার কারণ', 'question': 'অ্যাপেন্ডিসাইটিস হওয়ার কারণ কি?'}"
Others data - Sheet1.docx,33,অ্যাপেন্ডিসাইটিস হলে যখন ডাক্তারের কাছে  যেতে হবে,অ্যাপেন্ডিসাইটিস হলে কখন ডাক্তারের কাছে যাবেন?,"{'fname': 'Others data - Sheet1.docx', 'id': 33, 'context': 'অ্যাপেন্ডিসাইটিস হলে যখন ডাক্তারের কাছে  যেতে হবে', 'question': 'অ্যাপেন্ডিসাইটিস হলে কখন ডাক্তারের কাছে যাবেন?'}"
Others data - Sheet1.docx,34,অ্যাপেন্ডিসাইটিস এর চিকিৎসা,অ্যাপেন্ডিসাইটিস এর চিকিৎসা কিভাবে করা হয়?,"{'fname': 'Others data - Sheet1.docx', 'id': 34, 'context': 'অ্যাপেন্ডিসাইটিস এর চিকিৎসা', 'question': 'অ্যাপেন্ডিসাইটিস এর চিকিৎসা কিভাবে করা হয়?'}"
Others data - Sheet1.docx,35,ইউরিন ইনফেকশন বা প্রস্রাবের সংক্রমণ,ইউরিন ইনফেকশন বা প্রস্রাবের সংক্রমণ কী?,"{'fname': 'Others data - Sheet1.docx', 'id': 35, 'context': 'ইউরিন ইনফেকশন বা প্রস্রাবের সংক্রমণ', 'question': 'ইউরিন ইনফেকশন বা প্রস্রাবের সংক্রমণ কী?'}"
Others data - Sheet1.docx,36,ইউরিন ইনফেকশন বা প্রস্রাবের সংক্রমণ,ইউরিন ইনফেকশন কী?,"{'fname': 'Others data - Sheet1.docx', 'id': 36, 'context': 'ইউরিন ইনফেকশন বা প্রস্রাবের সংক্রমণ', 'question': 'ইউরিন ইনফেকশন কী?'}"
Others data - Sheet1.docx,37,ইউরিন ইনফেকশনের লক্ষণ,ইউরিন ইনফেকশনের লক্ষণ কী কী?,"{'fname': 'Others data - Sheet1.docx', 'id': 37, 'context': 'ইউরিন ইনফেকশনের লক্ষণ', 'question': 'ইউরিন ইনফেকশনের লক্ষণ কী কী?'}"
Others data - Sheet1.docx,38,ইউরিন ইনফেকশনের কারণ,ইউরিন ইনফেকশনের কারণ কী?,"{'fname': 'Others data - Sheet1.docx', 'id': 38, 'context': 'ইউরিন ইনফেকশনের কারণ', 'question': 'ইউরিন ইনফেকশনের কারণ কী?'}"
Others data - Sheet1.docx,39,ইউরিন ইনফেকশনের চিকিৎসা,ইউরিন ইনফেকশনের চিকিৎসা কী?,"{'fname': 'Others data - Sheet1.docx', 'id': 39, 'context': 'ইউরিন ইনফেকশনের চিকিৎসা', 'question': 'ইউরিন ইনফেকশনের চিকিৎসা কী?'}"
Others data - Sheet1.docx,40,ইউরিন ইনফেকশনের জন্য কী কী জটিলতা,ইউরিন ইনফেকশনের জন্য কী কী জটিলতা হয়?,"{'fname': 'Others data - Sheet1.docx', 'id': 40, 'context': 'ইউরিন ইনফেকশনের জন্য কী কী জটিলতা', 'question': 'ইউরিন ইনফেকশনের জন্য কী কী জটিলতা হয়?'}"
Others data - Sheet1.docx,41,ইউরিন ইনফেকশন প্রতিরোধ,ইউরিন ইনফেকশন প্রতিরোধ কীভাবে করা যায়?,"{'fname': 'Others data - Sheet1.docx', 'id': 41, 'context': 'ইউরিন ইনফেকশন প্রতিরোধ', 'question': 'ইউরিন ইনফেকশন প্রতিরোধ কীভাবে করা যায়?'}"
Others data - Sheet1.docx,42,উচ্চ রক্তচাপ,উচ্চ রক্তচাপ কি?,"{'fname': 'Others data - Sheet1.docx', 'id': 42, 'context': 'উচ্চ রক্তচাপ', 'question': 'উচ্চ রক্তচাপ কি?'}"
Others data - Sheet1.docx,43,উচ্চ রক্তচাপের লক্ষণসমূহ,উচ্চ রক্তচাপের লক্ষণসমূহ কি কি?,"{'fname': 'Others data - Sheet1.docx', 'id': 43, 'context': 'উচ্চ রক্তচাপের লক্ষণসমূহ', 'question': 'উচ্চ রক্তচাপের লক্ষণসমূহ কি কি?'}"
Others data - Sheet1.docx,44,রক্তচাপ বেড়ে যাওয়ার কারণ,রক্তচাপ বেড়ে যাওয়ার কারণ কি কি হতে পারে?,"{'fname': 'Others data - Sheet1.docx', 'id': 44, 'context': 'রক্তচাপ বেড়ে যাওয়ার কারণ', 'question': 'রক্তচাপ বেড়ে যাওয়ার কারণ কি কি হতে পারে?'}"
Others data - Sheet1.docx,45,উচ্চ রক্তচাপের ঝুঁকি,উচ্চ রক্তচাপের ঝুঁকি কি কি হতে পারে?,"{'fname': 'Others data - Sheet1.docx', 'id': 45, 'context': 'উচ্চ রক্তচাপের ঝুঁকি', 'question': 'উচ্চ রক্তচাপের ঝুঁকি কি কি হতে পারে?'}"
Others data - Sheet1.docx,46,উচ্চ রক্তচাপ কমানোর উপায়,উচ্চ রক্তচাপ কমানোর উপায় কি কি?,"{'fname': 'Others data - Sheet1.docx', 'id': 46, 'context': 'উচ্চ রক্তচাপ কমানোর উপায়', 'question': 'উচ্চ রক্তচাপ কমানোর উপায় কি কি?'}"
Others data - Sheet1.docx,55,এক্টোপিক প্রেগন্যান্সি,এক্টোপিক প্রেগন্যান্সি হলে কখন ডাক্তারের কাছে যাবেন?,"{'fname': 'Others data - Sheet1.docx', 'id': 55, 'context': 'এক্টোপিক প্রেগন্যান্সি', 'question': 'এক্টোপিক প্রেগন্যান্সি হলে কখন ডাক্তারের কাছে যাবেন?'}"
Others data - Sheet1.docx,61,এনাল ফিসার,এনাল ফিসার বা গেজ রোগ কি?,"{'fname': 'Others data - Sheet1.docx', 'id': 61, 'context': 'এনাল ফিসার', 'question': 'এনাল ফিসার বা গেজ রোগ কি?'}"
Others data - Sheet1.docx,62,এনাল ফিসার,এনাল ফিসার কী?,"{'fname': 'Others data - Sheet1.docx', 'id': 62, 'context': 'এনাল ফিসার', 'question': 'এনাল ফিসার কী?'}"
Others data - Sheet1.docx,63,এনাল ফিসারের লক্ষণগুলো,এনাল ফিসারের লক্ষণগুলো কী কী?,"{'fname': 'Others data - Sheet1.docx', 'id': 63, 'context': 'এনাল ফিসারের লক্ষণগুলো', 'question': 'এনাল ফিসারের লক্ষণগুলো কী কী?'}"
Others data - Sheet1.docx,64,এনাল ফিসার এর কারন,এনাল ফিসার কেন হয়?,"{'fname': 'Others data - Sheet1.docx', 'id': 64, 'context': 'এনাল ফিসার এর কারন', 'question': 'এনাল ফিসার কেন হয়?'}"
Others data - Sheet1.docx,65,মলদ্বারের ব্যথা কমানোর উপায়,মলদ্বারের ব্যথা কমানোর উপায় কি?,"{'fname': 'Others data - Sheet1.docx', 'id': 65, 'context': 'মলদ্বারের ব্যথা কমানোর উপায়', 'question': 'মলদ্বারের ব্যথা কমানোর উপায় কি?'}"
Others data - Sheet1.docx,66,গেজ রোগের ঘরোয়া চিকিৎসা,গেজ রোগের ঘরোয়া চিকিৎসা কি কি?,"{'fname': 'Others data - Sheet1.docx', 'id': 66, 'context': 'গেজ রোগের ঘরোয়া চিকিৎসা', 'question': 'গেজ রোগের ঘরোয়া চিকিৎসা কি কি?'}"
Others data - Sheet1.docx,67,এনাল ফিসার ও পাইলস-এর পার্থক্য,এনাল ফিসার ও পাইলস-এর মধ্যে কিভাবে পার্থক্য করবেন?,"{'fname': 'Others data - Sheet1.docx', 'id': 67, 'context': 'এনাল ফিসার ও পাইলস-এর পার্থক্য', 'question': 'এনাল ফিসার ও পাইলস-এর মধ্যে কিভাবে পার্থক্য করবেন?'}"
Others data - Sheet1.docx,68,গেজ রোগের চিকিৎসা,গেজ রোগের অন্যান্য চিকিৎসা কি কি?,"{'fname': 'Others data - Sheet1.docx', 'id': 68, 'context': 'গেজ রোগের চিকিৎসা', 'question': 'গেজ রোগের অন্যান্য চিকিৎসা কি কি?'}"
Others data - Sheet1.docx,69,এনাল ফিস্টুলা,এনাল ফিস্টুলা কি?,"{'fname': 'Others data - Sheet1.docx', 'id': 69, 'context': 'এনাল ফিস্টুলা', 'question': 'এনাল ফিস্টুলা কি?'}"
Others data - Sheet1.docx,70,এনাল ফিস্টুলার লক্ষণ,এনাল ফিস্টুলার লক্ষণ কি?,"{'fname': 'Others data - Sheet1.docx', 'id': 70, 'context': 'এনাল ফিস্টুলার লক্ষণ', 'question': 'এনাল ফিস্টুলার লক্ষণ কি?'}"
Others data - Sheet1.docx,71,এনাল ফিস্টুলা হওয়ার কারণ,এনাল ফিস্টুলা হওয়ার কারণ কি?,"{'fname': 'Others data - Sheet1.docx', 'id': 71, 'context': 'এনাল ফিস্টুলা হওয়ার কারণ', 'question': 'এনাল ফিস্টুলা হওয়ার কারণ কি?'}"
Others data - Sheet1.docx,72,এনাল ফিস্টুলা হলে করণীয়,এনাল ফিস্টুলা হলে করণীয় কি?,"{'fname': 'Others data - Sheet1.docx', 'id': 72, 'context': 'এনাল ফিস্টুলা হলে করণীয়', 'question': 'এনাল ফিস্টুলা হলে করণীয় কি?'}"
Others data - Sheet1.docx,73,এনাল ফিস্টুলার চিকিৎসা,এনাল ফিস্টুলার চিকিৎসা কি?,"{'fname': 'Others data - Sheet1.docx', 'id': 73, 'context': 'এনাল ফিস্টুলার চিকিৎসা', 'question': 'এনাল ফিস্টুলার চিকিৎসা কি?'}"
Others data - Sheet1.docx,74,এনাল ফিস্টুলার অপারেশ,এনাল ফিস্টুলার অপারেশনের পর সাধারণত কি কি অসুবিধা দেখা দিতে পারে?,"{'fname': 'Others data - Sheet1.docx', 'id': 74, 'context': 'এনাল ফিস্টুলার অপারেশ', 'question': 'এনাল ফিস্টুলার অপারেশনের পর সাধারণত কি কি অসুবিধা দেখা দিতে পারে?'}"
Others data - Sheet1.docx,81,এলার্জি,এলার্জি কি?,"{'fname': 'Others data - Sheet1.docx', 'id': 81, 'context': 'এলার্জি', 'question': 'এলার্জি কি?'}"
Others data - Sheet1.docx,82,এলার্জির কারণসমূহ,এলার্জির কারণসমূহ কি কি ?,"{'fname': 'Others data - Sheet1.docx', 'id': 82, 'context': 'এলার্জির কারণসমূহ', 'question': 'এলার্জির কারণসমূহ কি কি ?'}"
Others data - Sheet1.docx,83,এলার্জির লক্ষণসমূহ,এলার্জির লক্ষণসমূহ কি কি?,"{'fname': 'Others data - Sheet1.docx', 'id': 83, 'context': 'এলার্জির লক্ষণসমূহ', 'question': 'এলার্জির লক্ষণসমূহ কি কি?'}"
Others data - Sheet1.docx,84,এলার্জির জন্য যখন ডাক্তারের কাছে যেতে হবে,এলার্জির জন্যে কখন ডাক্তারের কাছে যেতে হবে?,"{'fname': 'Others data - Sheet1.docx', 'id': 84, 'context': 'এলার্জির জন্য যখন ডাক্তারের কাছে যেতে হবে', 'question': 'এলার্জির জন্যে কখন ডাক্তারের কাছে যেতে হবে?'}"
Others data - Sheet1.docx,85,এলার্জির চিকিৎসা,এলার্জির চিকিৎসা কি ?,"{'fname': 'Others data - Sheet1.docx', 'id': 85, 'context': 'এলার্জির চিকিৎসা', 'question': 'এলার্জির চিকিৎসা কি ?'}"
Others data - Sheet1.docx,86,এলার্জি প্রতিরোধ উপায়গুলো,এলার্জি প্রতিরোধ উপায়গুলো কি কি?,"{'fname': 'Others data - Sheet1.docx', 'id': 86, 'context': 'এলার্জি প্রতিরোধ উপায়গুলো', 'question': 'এলার্জি প্রতিরোধ উপায়গুলো কি কি?'}"
Others data - Sheet1.docx,87,এলার্জি নির্ণয়,এলার্জি কিভাবে রোগনির্ণয় করবো এবং নির্ণয়ের পরীক্ষাসমূহ ও ?,"{'fname': 'Others data - Sheet1.docx', 'id': 87, 'context': 'এলার্জি নির্ণয়', 'question': 'এলার্জি কিভাবে রোগনির্ণয় করবো এবং নির্ণয়ের পরীক্ষাসমূহ ও ?'}"
Others data - Sheet1.docx,89,এলার্জিক রাইনাইটিস,এলার্জিক রাইনাইটিস কি?,"{'fname': 'Others data - Sheet1.docx', 'id': 89, 'context': 'এলার্জিক রাইনাইটিস', 'question': 'এলার্জিক রাইনাইটিস কি?'}"
Others data - Sheet1.docx,90,এলার্জিক রাইনাইটিসের লক্ষণসমূহ,এলার্জিক রাইনাইটিসের লক্ষণসমূহ কি কি?,"{'fname': 'Others data - Sheet1.docx', 'id': 90, 'context': 'এলার্জিক রাইনাইটিসের লক্ষণসমূহ', 'question': 'এলার্জিক রাইনাইটিসের লক্ষণসমূহ কি কি?'}"
Others data - Sheet1.docx,91,এলার্জিক রাইনাইটিসের কারণ সমূহ,এলার্জিক রাইনাইটিসের কারণ সমূহ কি কি?,"{'fname': 'Others data - Sheet1.docx', 'id': 91, 'context': 'এলার্জিক রাইনাইটিসের কারণ সমূহ', 'question': 'এলার্জিক রাইনাইটিসের কারণ সমূহ কি কি?'}"
Others data - Sheet1.docx,92,এলার্জিক রাইনাইটিসের চিকিৎসা,এলার্জিক রাইনাইটিসের চিকিৎসা কি?,"{'fname': 'Others data - Sheet1.docx', 'id': 92, 'context': 'এলার্জিক রাইনাইটিসের চিকিৎসা', 'question': 'এলার্জিক রাইনাইটিসের চিকিৎসা কি?'}"
Others data - Sheet1.docx,93,এলার্জিক রাইনাইটিস প্রতিরোধ,এলার্জিক রাইনাইটিস প্রতিরোধ কিভাবে করা যায়?,"{'fname': 'Others data - Sheet1.docx', 'id': 93, 'context': 'এলার্জিক রাইনাইটিস প্রতিরোধ', 'question': 'এলার্জিক রাইনাইটিস প্রতিরোধ কিভাবে করা যায়?'}"
Others data - Sheet1.docx,94,এলার্জিক রাইনাইটিস নির্ণয়,এলার্জিক রাইনাইটিস নির্ণয় কি?,"{'fname': 'Others data - Sheet1.docx', 'id': 94, 'context': 'এলার্জিক রাইনাইটিস নির্ণয়', 'question': 'এলার্জিক রাইনাইটিস নির্ণয় কি?'}"
Others data - Sheet1.docx,95,এলার্জিক রাইনাইটিসের জটিলতাগুলো,এলার্জিক রাইনাইটিসের জটিলতাগুলো কি কি?,"{'fname': 'Others data - Sheet1.docx', 'id': 95, 'context': 'এলার্জিক রাইনাইটিসের জটিলতাগুলো', 'question': 'এলার্জিক রাইনাইটিসের জটিলতাগুলো কি কি?'}"
Others data - Sheet1.docx,96,কানে ব্যথা,কানে ব্যথা কি?,"{'fname': 'Others data - Sheet1.docx', 'id': 96, 'context': 'কানে ব্যথা', 'question': 'কানে ব্যথা কি?'}"
Others data - Sheet1.docx,97,কানে ব্যথার   কারণ,কানে ব্যথার কি কি কারণ হতে পারে?,"{'fname': 'Others data - Sheet1.docx', 'id': 97, 'context': 'কানে ব্যথার   কারণ', 'question': 'কানে ব্যথার কি কি কারণ হতে পারে?'}"
