fname,id,context,question,answer
Antepartum care_Dr Pronov.docx,2,গর্ভাবস্থায় অতিরিক্ত বমি বা হাইপারএমেসিস গ্রাভিডেরাম,গর্ভাবস্থায় হাইপারএমেসিস গ্র্যাভিডেরাম এর লক্ষণ কি?,"{'fname': 'Antepartum care_Dr Pronov.docx', 'id': 2, 'context': 'গর্ভাবস্থায় অতিরিক্ত বমি বা হাইপারএমেসিস গ্রাভিডেরাম', 'question': 'গর্ভাবস্থায় হাইপারএমেসিস গ্র্যাভিডেরাম এর লক্ষণ কি?'}"
Antepartum care_Dr Pronov.docx,4,গর্ভাবস্থায় অতিরিক্ত বমি বা হাইপারএমেসিস গ্রাভিডেরাম,গর্ভাবস্থায় হাইপারএমেসিস গ্র্যাভিডেরাম এর চিকিৎসা কি?,"{'fname': 'Antepartum care_Dr Pronov.docx', 'id': 4, 'context': 'গর্ভাবস্থায় অতিরিক্ত বমি বা হাইপারএমেসিস গ্রাভিডেরাম', 'question': 'গর্ভাবস্থায় হাইপারএমেসিস গ্র্যাভিডেরাম এর চিকিৎসা কি?'}"
Antepartum care_Dr Pronov.docx,6,গর্ভাবস্থায় অতিরিক্ত বমি বা হাইপারএমেসিস গ্রাভিডেরাম,গর্ভাবস্থায় হাইপারএমেসিস গ্র্যাভিডেরামের অন্য আরও কী কী উপসর্গ থাকতে পারে?,"{'fname': 'Antepartum care_Dr Pronov.docx', 'id': 6, 'context': 'গর্ভাবস্থায় অতিরিক্ত বমি বা হাইপারএমেসিস গ্রাভিডেরাম', 'question': 'গর্ভাবস্থায় হাইপারএমেসিস গ্র্যাভিডেরামের অন্য আরও কী কী উপসর্গ থাকতে পারে?'}"
Antepartum care_Dr Pronov.docx,9,গর্ভাবস্থায় অনিদ্রা,গর্ভাবস্থায় অনিদ্রার কারণ সমূহ কি কি?,"{'fname': 'Antepartum care_Dr Pronov.docx', 'id': 9, 'context': 'গর্ভাবস্থায় অনিদ্রা', 'question': 'গর্ভাবস্থায় অনিদ্রার কারণ সমূহ কি কি?'}"
Antepartum care_Dr Pronov.docx,11,গর্ভাবস্থায় অনিদ্রা,গর্ভাবস্থায় অনিদ্রার ঘরোয়া চিকিৎসা কি?,"{'fname': 'Antepartum care_Dr Pronov.docx', 'id': 11, 'context': 'গর্ভাবস্থায় অনিদ্রা', 'question': 'গর্ভাবস্থায় অনিদ্রার ঘরোয়া চিকিৎসা কি?'}"
Antepartum care_Dr Pronov.docx,12,গর্ভাবস্থায় অনিদ্রা,গর্ভাবস্থায় অনিদ্রার ঔষধ কি?,"{'fname': 'Antepartum care_Dr Pronov.docx', 'id': 12, 'context': 'গর্ভাবস্থায় অনিদ্রা', 'question': 'গর্ভাবস্থায় অনিদ্রার ঔষধ কি?'}"
Antepartum care_Dr Pronov.docx,14,গর্ভকালীন অবসাদ,গর্ভাবস্থায় অবসাদের কারণ কী?,"{'fname': 'Antepartum care_Dr Pronov.docx', 'id': 14, 'context': 'গর্ভকালীন অবসাদ', 'question': 'গর্ভাবস্থায় অবসাদের কারণ কী?'}"
Antepartum care_Dr Pronov.docx,16,গর্ভকালীন অবসাদ,গর্ভকালীন অবসাদ থেকে প্রতিকারের উপায় কি?,"{'fname': 'Antepartum care_Dr Pronov.docx', 'id': 16, 'context': 'গর্ভকালীন অবসাদ', 'question': 'গর্ভকালীন অবসাদ থেকে প্রতিকারের উপায় কি?'}"
Antepartum care_Dr Pronov.docx,17,গর্ভকালীন অবসাদ,মাস অনুযায়ী গর্ভকালীন অবসাদ কেমন হয়?,"{'fname': 'Antepartum care_Dr Pronov.docx', 'id': 17, 'context': 'গর্ভকালীন অবসাদ', 'question': 'মাস অনুযায়ী গর্ভকালীন অবসাদ কেমন হয়?'}"
Antepartum care_Dr Pronov.docx,47,গর্ভকালীন উচ্চ রক্তচাপ,গর্ভাবস্থায় উচ্চ রক্তচাপ কি?,"{'fname': 'Antepartum care_Dr Pronov.docx', 'id': 47, 'context': 'গর্ভকালীন উচ্চ রক্তচাপ', 'question': 'গর্ভাবস্থায় উচ্চ রক্তচাপ কি?'}"
Antepartum care_Dr Pronov.docx,48,গর্ভকালীন উচ্চ রক্তচাপ,গর্ভকালীন উচ্চ রক্তচাপের ধরন কেমন হয়?,"{'fname': 'Antepartum care_Dr Pronov.docx', 'id': 48, 'context': 'গর্ভকালীন উচ্চ রক্তচাপ', 'question': 'গর্ভকালীন উচ্চ রক্তচাপের ধরন কেমন হয়?'}"
Antepartum care_Dr Pronov.docx,49,গর্ভকালীন উচ্চ রক্তচাপ,গর্ভাবস্থায় ব্লাড প্রেসারের ব্যাপারে কিভাবে সতর্ক থাকা যায়?,"{'fname': 'Antepartum care_Dr Pronov.docx', 'id': 49, 'context': 'গর্ভকালীন উচ্চ রক্তচাপ', 'question': 'গর্ভাবস্থায় ব্লাড প্রেসারের ব্যাপারে কিভাবে সতর্ক থাকা যায়?'}"
Antepartum care_Dr Pronov.docx,50,গর্ভকালীন উচ্চ রক্তচাপ,গর্ভাবস্থায় ব্লাড প্রেসার বেড়ে গেলে করণীয় কি?,"{'fname': 'Antepartum care_Dr Pronov.docx', 'id': 50, 'context': 'গর্ভকালীন উচ্চ রক্তচাপ', 'question': 'গর্ভাবস্থায় ব্লাড প্রেসার বেড়ে গেলে করণীয় কি?'}"
Antepartum care_Dr Pronov.docx,51,গর্ভকালীন উচ্চ রক্তচাপ,গর্ভাবস্থায় উচ্চ রক্তচাপ জনিত জটিলতা কি কি হতে পারে?,"{'fname': 'Antepartum care_Dr Pronov.docx', 'id': 51, 'context': 'গর্ভকালীন উচ্চ রক্তচাপ', 'question': 'গর্ভাবস্থায় উচ্চ রক্তচাপ জনিত জটিলতা কি কি হতে পারে?'}"
Antepartum care_Dr Pronov.docx,54,এক্টোপিক প্রেগন্যান্সি,এক্টোপিক প্রেগন্যান্সির লক্ষণ কি?,"{'fname': 'Antepartum care_Dr Pronov.docx', 'id': 54, 'context': 'এক্টোপিক প্রেগন্যান্সি', 'question': 'এক্টোপিক প্রেগন্যান্সির লক্ষণ কি?'}"
Antepartum care_Dr Pronov.docx,56,এক্টোপিক প্রেগন্যান্সি,এক্টোপিক প্রেগন্যান্সি হলে কখন জরুরী ভিত্তিতে ডাক্তারের কাছে যেতে হবে?,"{'fname': 'Antepartum care_Dr Pronov.docx', 'id': 56, 'context': 'এক্টোপিক প্রেগন্যান্সি', 'question': 'এক্টোপিক প্রেগন্যান্সি হলে কখন জরুরী ভিত্তিতে ডাক্তারের কাছে যেতে হবে?'}"
Antepartum care_Dr Pronov.docx,57,এক্টোপিক প্রেগন্যান্সি,এক্টোপিক প্রেগন্যান্সির চিকিৎসা কি?,"{'fname': 'Antepartum care_Dr Pronov.docx', 'id': 57, 'context': 'এক্টোপিক প্রেগন্যান্সি', 'question': 'এক্টোপিক প্রেগন্যান্সির চিকিৎসা কি?'}"
Antepartum care_Dr Pronov.docx,58,এক্টোপিক প্রেগন্যান্সি,এক্টোপিক প্রেগন্যান্সির পরে মানসিক চাপ হলে করণীয় কি?,"{'fname': 'Antepartum care_Dr Pronov.docx', 'id': 58, 'context': 'এক্টোপিক প্রেগন্যান্সি', 'question': 'এক্টোপিক প্রেগন্যান্সির পরে মানসিক চাপ হলে করণীয় কি?'}"
Antepartum care_Dr Pronov.docx,59,এক্টোপিক প্রেগন্যান্সি,এক্টোপিক প্রেগন্যান্সি হবার কতদিন পর সন্তান নেবার চেষ্টা করবেন?,"{'fname': 'Antepartum care_Dr Pronov.docx', 'id': 59, 'context': 'এক্টোপিক প্রেগন্যান্সি', 'question': 'এক্টোপিক প্রেগন্যান্সি হবার কতদিন পর সন্তান নেবার চেষ্টা করবেন?'}"
Antepartum care_Dr Pronov.docx,60,এক্টোপিক প্রেগন্যান্সি,এক্টোপিক প্রেগন্যান্সি কেন হয়?,"{'fname': 'Antepartum care_Dr Pronov.docx', 'id': 60, 'context': 'এক্টোপিক প্রেগন্যান্সি', 'question': 'এক্টোপিক প্রেগন্যান্সি কেন হয়?'}"
Antepartum care_Dr Pronov.docx,101,গর্ভাবস্থায় কোমর ব্যথা,গর্ভাবস্থায় কোমর ব্যথা কখন হয় ?,"{'fname': 'Antepartum care_Dr Pronov.docx', 'id': 101, 'context': 'গর্ভাবস্থায় কোমর ব্যথা', 'question': 'গর্ভাবস্থায় কোমর ব্যথা কখন হয় ?'}"
Antepartum care_Dr Pronov.docx,102,গর্ভাবস্থায় কোমর ব্যথা,গর্ভাবস্থায় কোমর ব্যথা সারানোর উপায় সমূহ কি কি?,"{'fname': 'Antepartum care_Dr Pronov.docx', 'id': 102, 'context': 'গর্ভাবস্থায় কোমর ব্যথা', 'question': 'গর্ভাবস্থায় কোমর ব্যথা সারানোর উপায় সমূহ কি কি?'}"
Antepartum care_Dr Pronov.docx,111,গর্ভাবস্থায় কোষ্ঠকাঠিন্য,গর্ভাবস্থায় কোষ্ঠকাঠিন্য হতে পারে কি ?,"{'fname': 'Antepartum care_Dr Pronov.docx', 'id': 111, 'context': 'গর্ভাবস্থায় কোষ্ঠকাঠিন্য', 'question': 'গর্ভাবস্থায় কোষ্ঠকাঠিন্য হতে পারে কি ?'}"
Antepartum care_Dr Pronov.docx,113,গর্ভাবস্থায় কোষ্ঠকাঠিন্য,গর্ভাবস্থায় কোষ্ঠকাঠিন্য হয়েছে কি না তা কীভাবে বুঝবেন?,"{'fname': 'Antepartum care_Dr Pronov.docx', 'id': 113, 'context': 'গর্ভাবস্থায় কোষ্ঠকাঠিন্য', 'question': 'গর্ভাবস্থায় কোষ্ঠকাঠিন্য হয়েছে কি না তা কীভাবে বুঝবেন?'}"
Antepartum care_Dr Pronov.docx,123,গর্ভাবস্থায় ক্ষুধা,গর্ভাবস্থায় খাবার খাওয়ার তীব্র ইচ্ছা হলে কি করতে হবে ?,"{'fname': 'Antepartum care_Dr Pronov.docx', 'id': 123, 'context': 'গর্ভাবস্থায় ক্ষুধা', 'question': 'গর্ভাবস্থায় খাবার খাওয়ার তীব্র ইচ্ছা হলে কি করতে হবে ?'}"
Antepartum care_Dr Pronov.docx,124,গর্ভাবস্থায় ক্ষুধা,গর্ভাবস্থায় খাবার খাওয়ার তীব্র ইচ্ছা কখন হয়?,"{'fname': 'Antepartum care_Dr Pronov.docx', 'id': 124, 'context': 'গর্ভাবস্থায় ক্ষুধা', 'question': 'গর্ভাবস্থায় খাবার খাওয়ার তীব্র ইচ্ছা কখন হয়?'}"
Antepartum care_Dr Pronov.docx,125,গর্ভাবস্থায় ক্ষুধা,গর্ভাবস্থায়  কোন ধরনের খাবার খাওয়ার তীব্র ইচ্ছা হয়?,"{'fname': 'Antepartum care_Dr Pronov.docx', 'id': 125, 'context': 'গর্ভাবস্থায় ক্ষুধা', 'question': 'গর্ভাবস্থায়  কোন ধরনের খাবার খাওয়ার তীব্র ইচ্ছা হয়?'}"
Antepartum care_Dr Pronov.docx,126,গর্ভাবস্থায় ক্ষুধা,গর্ভাবস্থায় খাবার খাওয়ার তীব্র ইচ্ছা হলে কী করবেন?,"{'fname': 'Antepartum care_Dr Pronov.docx', 'id': 126, 'context': 'গর্ভাবস্থায় ক্ষুধা', 'question': 'গর্ভাবস্থায় খাবার খাওয়ার তীব্র ইচ্ছা হলে কী করবেন?'}"
Antepartum care_Dr Pronov.docx,127,গর্ভাবস্থায় ক্ষুধা,গর্ভাবস্থায় খাবার খাওয়ার তীব্র ইচ্ছা  কেন হয়?,"{'fname': 'Antepartum care_Dr Pronov.docx', 'id': 127, 'context': 'গর্ভাবস্থায় ক্ষুধা', 'question': 'গর্ভাবস্থায় খাবার খাওয়ার তীব্র ইচ্ছা  কেন হয়?'}"
Antepartum care_Dr Pronov.docx,135,গর্ভাবস্থায় অজ্ঞান হয়ে যাওয়া,গর্ভাবস্থায় অজ্ঞান হয়ে যাওয়ার কারন  কি ?,"{'fname': 'Antepartum care_Dr Pronov.docx', 'id': 135, 'context': 'গর্ভাবস্থায় অজ্ঞান হয়ে যাওয়া', 'question': 'গর্ভাবস্থায় অজ্ঞান হয়ে যাওয়ার কারন  কি ?'}"
Antepartum care_Dr Pronov.docx,136,গর্ভাবস্থায় অজ্ঞান হয়ে যাওয়া,গর্ভাবস্থায় অজ্ঞান হওয়ার পূর্বলক্ষণ কি কি  ?,"{'fname': 'Antepartum care_Dr Pronov.docx', 'id': 136, 'context': 'গর্ভাবস্থায় অজ্ঞান হয়ে যাওয়া', 'question': 'গর্ভাবস্থায় অজ্ঞান হওয়ার পূর্বলক্ষণ কি কি  ?'}"
Antepartum care_Dr Pronov.docx,137,গর্ভাবস্থায় অজ্ঞান হয়ে যাওয়া,গর্ভাবস্থায় অজ্ঞান হচ্ছেন মনে হলে করণীয় কি ?,"{'fname': 'Antepartum care_Dr Pronov.docx', 'id': 137, 'context': 'গর্ভাবস্থায় অজ্ঞান হয়ে যাওয়া', 'question': 'গর্ভাবস্থায় অজ্ঞান হচ্ছেন মনে হলে করণীয় কি ?'}"
Antepartum care_Dr Pronov.docx,138,গর্ভাবস্থায় অজ্ঞান হয়ে যাওয়া,গর্ভাবস্থায় পড়ে যাওয়া থেকে সম্ভাব্য স্বাস্থ্যঝুঁকি কি কি ?,"{'fname': 'Antepartum care_Dr Pronov.docx', 'id': 138, 'context': 'গর্ভাবস্থায় অজ্ঞান হয়ে যাওয়া', 'question': 'গর্ভাবস্থায় পড়ে যাওয়া থেকে সম্ভাব্য স্বাস্থ্যঝুঁকি কি কি ?'}"
Antepartum care_Dr Pronov.docx,139,গর্ভাবস্থায় অজ্ঞান হয়ে যাওয়া,গর্ভাবস্থায় অজ্ঞান হওয়া প্রতিরোধের উপায় কি ?,"{'fname': 'Antepartum care_Dr Pronov.docx', 'id': 139, 'context': 'গর্ভাবস্থায় অজ্ঞান হয়ে যাওয়া', 'question': 'গর্ভাবস্থায় অজ্ঞান হওয়া প্রতিরোধের উপায় কি ?'}"
Antepartum care_Dr Pronov.docx,144,গর্ভাবস্থায় অতিরিক্ত গরম লাগা,গর্ভাবস্থায় অতিরিক্ত গরম থেকে জটিলতা ?,"{'fname': 'Antepartum care_Dr Pronov.docx', 'id': 144, 'context': 'গর্ভাবস্থায় অতিরিক্ত গরম লাগা', 'question': 'গর্ভাবস্থায় অতিরিক্ত গরম থেকে জটিলতা ?'}"
Antepartum care_Dr Pronov.docx,145,গর্ভাবস্থায় অতিরিক্ত গরম লাগা,গর্ভাবস্থায় অতিরিক্ত গরম থেকে প্রতিরোধ এর উপায় কি কি ?,"{'fname': 'Antepartum care_Dr Pronov.docx', 'id': 145, 'context': 'গর্ভাবস্থায় অতিরিক্ত গরম লাগা', 'question': 'গর্ভাবস্থায় অতিরিক্ত গরম থেকে প্রতিরোধ এর উপায় কি কি ?'}"
Antepartum care_Dr Pronov.docx,149,গর্ভাবস্থায় চুলকানি,গর্ভকালীন চুলকানির কার্যকর ঘরোয়া সমাধান কী ?,"{'fname': 'Antepartum care_Dr Pronov.docx', 'id': 149, 'context': 'গর্ভাবস্থায় চুলকানি', 'question': 'গর্ভকালীন চুলকানির কার্যকর ঘরোয়া সমাধান কী ?'}"
Antepartum care_Dr Pronov.docx,151,গর্ভাবস্থায় চুলকানি,গর্ভাবস্থার বিশেষ লিভারের রোগ  এ কী  উপসর্গ দেখা  যায় ?,"{'fname': 'Antepartum care_Dr Pronov.docx', 'id': 151, 'context': 'গর্ভাবস্থায় চুলকানি', 'question': 'গর্ভাবস্থার বিশেষ লিভারের রোগ  এ কী  উপসর্গ দেখা  যায় ?'}"
Antepartum care_Dr Pronov.docx,153,গর্ভাবস্থায় চুলকানি,গর্ভকালীন চুলকানির ঔষধ  কী ?,"{'fname': 'Antepartum care_Dr Pronov.docx', 'id': 153, 'context': 'গর্ভাবস্থায় চুলকানি', 'question': 'গর্ভকালীন চুলকানির ঔষধ  কী ?'}"
Antepartum care_Dr Pronov.docx,155,গর্ভাবস্থায় চোখে ঝাপসা দেখা,গর্ভাবস্থায় চোখে ঝাপসা দেখার কারণ কী ?,"{'fname': 'Antepartum care_Dr Pronov.docx', 'id': 155, 'context': 'গর্ভাবস্থায় চোখে ঝাপসা দেখা', 'question': 'গর্ভাবস্থায় চোখে ঝাপসা দেখার কারণ কী ?'}"
Antepartum care_Dr Pronov.docx,156,গর্ভাবস্থায় চোখে ঝাপসা দেখা,গর্ভাবস্থায় চোখে ঝাপসা দেখা কখন সম্ভাব্য জটিলতার লক্ষণ ?,"{'fname': 'Antepartum care_Dr Pronov.docx', 'id': 156, 'context': 'গর্ভাবস্থায় চোখে ঝাপসা দেখা', 'question': 'গর্ভাবস্থায় চোখে ঝাপসা দেখা কখন সম্ভাব্য জটিলতার লক্ষণ ?'}"
Antepartum care_Dr Pronov.docx,157,গর্ভাবস্থায় চোখে ঝাপসা দেখা,গর্ভাবস্থায় চোখে ঝাপসা দেখার চিকিৎসা  কি ?,"{'fname': 'Antepartum care_Dr Pronov.docx', 'id': 157, 'context': 'গর্ভাবস্থায় চোখে ঝাপসা দেখা', 'question': 'গর্ভাবস্থায় চোখে ঝাপসা দেখার চিকিৎসা  কি ?'}"
Antepartum care_Dr Pronov.docx,158,গর্ভাবস্থায় জ্বর,গর্ভাবস্থায় জ্বর  আসতে পারে কি ?,"{'fname': 'Antepartum care_Dr Pronov.docx', 'id': 158, 'context': 'গর্ভাবস্থায় জ্বর', 'question': 'গর্ভাবস্থায় জ্বর  আসতে পারে কি ?'}"
Antepartum care_Dr Pronov.docx,160,গর্ভাবস্থায় জ্বর,গর্ভাবস্থায় জ্বর হলে করণীয় কি?,"{'fname': 'Antepartum care_Dr Pronov.docx', 'id': 160, 'context': 'গর্ভাবস্থায় জ্বর', 'question': 'গর্ভাবস্থায় জ্বর হলে করণীয় কি?'}"
Antepartum care_Dr Pronov.docx,161,গর্ভাবস্থায় জ্বর,গর্ভাবস্থায় জ্বরের কারণ ?,"{'fname': 'Antepartum care_Dr Pronov.docx', 'id': 161, 'context': 'গর্ভাবস্থায় জ্বর', 'question': 'গর্ভাবস্থায় জ্বরের কারণ ?'}"
Antepartum care_Dr Pronov.docx,162,গর্ভাবস্থায় জ্বর,গর্ভাবস্থায় জ্বরের প্রতিরোধ ?,"{'fname': 'Antepartum care_Dr Pronov.docx', 'id': 162, 'context': 'গর্ভাবস্থায় জ্বর', 'question': 'গর্ভাবস্থায় জ্বরের প্রতিরোধ ?'}"
Antepartum care_Dr Pronov.docx,166,গর্ভাবস্থায় ডায়রিয়া,গর্ভাবস্থায় ডায়রিয়ার ঘরোয়া চিকিৎসা কি ?,"{'fname': 'Antepartum care_Dr Pronov.docx', 'id': 166, 'context': 'গর্ভাবস্থায় ডায়রিয়া', 'question': 'গর্ভাবস্থায় ডায়রিয়ার ঘরোয়া চিকিৎসা কি ?'}"
Antepartum care_Dr Pronov.docx,169,গর্ভাবস্থায় ডায়রিয়া,গর্ভাবস্থায় ডায়রিয়া নিয়ে কিছু প্রচলিত ধারণা কি কি ?,"{'fname': 'Antepartum care_Dr Pronov.docx', 'id': 169, 'context': 'গর্ভাবস্থায় ডায়রিয়া', 'question': 'গর্ভাবস্থায় ডায়রিয়া নিয়ে কিছু প্রচলিত ধারণা কি কি ?'}"
Antepartum care_Dr Pronov.docx,174,গর্ভাবস্থায় নাক দিয়ে রক্ত পড়া,গর্ভাবস্থায় নাক দিয়ে রক্ত পড়া প্রতিরোধের উপায়,"{'fname': 'Antepartum care_Dr Pronov.docx', 'id': 174, 'context': 'গর্ভাবস্থায় নাক দিয়ে রক্ত পড়া', 'question': 'গর্ভাবস্থায় নাক দিয়ে রক্ত পড়া প্রতিরোধের উপায়'}"
Antepartum care_Dr Pronov.docx,183,গর্ভাবস্থায় পানি ভাঙা,গর্ভাবস্থায় অসময়ে পানি ভাঙ্গলে করণীয় ?,"{'fname': 'Antepartum care_Dr Pronov.docx', 'id': 183, 'context': 'গর্ভাবস্থায় পানি ভাঙা', 'question': 'গর্ভাবস্থায় অসময়ে পানি ভাঙ্গলে করণীয় ?'}"
Antepartum care_Dr Pronov.docx,186,গর্ভাবস্থায় পেট  শক্ত হওয়া,গর্ভাবস্থায় পেট শক্ত হলে করণীয় ?,"{'fname': 'Antepartum care_Dr Pronov.docx', 'id': 186, 'context': 'গর্ভাবস্থায় পেট  শক্ত হওয়া', 'question': 'গর্ভাবস্থায় পেট শক্ত হলে করণীয় ?'}"
Antepartum care_Dr Pronov.docx,188,গর্ভাবস্থায় পেট ব্যথা,গর্ভাবস্থায় পেট ব্যথার সাধারণ কারণ /,"{'fname': 'Antepartum care_Dr Pronov.docx', 'id': 188, 'context': 'গর্ভাবস্থায় পেট ব্যথা', 'question': 'গর্ভাবস্থায় পেট ব্যথার সাধারণ কারণ /'}"
