fname,id,context,question,answer
Others data - Sheet1.docx,2510,মুখের জ্বালা পোড়া নির্ণয় এবং চিকিৎসা করা,কিভাবে মুখের জ্বালা পোড়া নির্ণয় এবং চিকিৎসা করা যায়?,"{'fname': 'Others data - Sheet1.docx', 'id': 2510, 'context': 'মুখের জ্বালা পোড়া নির্ণয় এবং চিকিৎসা করা', 'question': 'কিভাবে মুখের জ্বালা পোড়া নির্ণয় এবং চিকিৎসা করা যায়?'}"
Others data - Sheet1.docx,2511,চোখ জ্বালাপোড়া,চোখ জ্বালাপোড়া কি?,"{'fname': 'Others data - Sheet1.docx', 'id': 2511, 'context': 'চোখ জ্বালাপোড়া', 'question': 'চোখ জ্বালাপোড়া কি?'}"
Others data - Sheet1.docx,2512,চোখ জ্বালাপোড়ার প্রধান যুক্ত লক্ষণ এবং উপসর্গগুলি,চোখ জ্বালাপোড়ার প্রধান যুক্ত লক্ষণ এবং উপসর্গগুলি কি কি?,"{'fname': 'Others data - Sheet1.docx', 'id': 2512, 'context': 'চোখ জ্বালাপোড়ার প্রধান যুক্ত লক্ষণ এবং উপসর্গগুলি', 'question': 'চোখ জ্বালাপোড়ার প্রধান যুক্ত লক্ষণ এবং উপসর্গগুলি কি কি?'}"
Others data - Sheet1.docx,2513,চোখ জ্বালাপোড়ার প্রধান কারণগুলি,চোখ জ্বালাপোড়ার প্রধান কারণগুলি কি কি?,"{'fname': 'Others data - Sheet1.docx', 'id': 2513, 'context': 'চোখ জ্বালাপোড়ার প্রধান কারণগুলি', 'question': 'চোখ জ্বালাপোড়ার প্রধান কারণগুলি কি কি?'}"
Others data - Sheet1.docx,2514,চোখ জ্বালাপোড়া নির্ণয় এবং চিকিৎসা করা,চোখ জ্বালাপোড়া কিভাবে নির্ণয় এবং চিকিৎসা করা হয়?,"{'fname': 'Others data - Sheet1.docx', 'id': 2514, 'context': 'চোখ জ্বালাপোড়া নির্ণয় এবং চিকিৎসা করা', 'question': 'চোখ জ্বালাপোড়া কিভাবে নির্ণয় এবং চিকিৎসা করা হয়?'}"
Others data - Sheet1.docx,2515,বুলিমিয়া নারভোসা (ইটিং ডিসঅর্ডার),বুলিমিয়া নারভোসা (ইটিং ডিসঅর্ডার) কি?,"{'fname': 'Others data - Sheet1.docx', 'id': 2515, 'context': 'বুলিমিয়া নারভোসা (ইটিং ডিসঅর্ডার)', 'question': 'বুলিমিয়া নারভোসা (ইটিং ডিসঅর্ডার) কি?'}"
Others data - Sheet1.docx,2516,বুলিমিয়া নারভোসা (ইটিং ডিসঅর্ডার) এর প্রধান লক্ষণ এবং উপসর্গগুলি,বুলিমিয়া নারভোসা (ইটিং ডিসঅর্ডার) এর প্রধান লক্ষণ এবং উপসর্গগুলি কি কি?,"{'fname': 'Others data - Sheet1.docx', 'id': 2516, 'context': 'বুলিমিয়া নারভোসা (ইটিং ডিসঅর্ডার) এর প্রধান লক্ষণ এবং উপসর্গগুলি', 'question': 'বুলিমিয়া নারভোসা (ইটিং ডিসঅর্ডার) এর প্রধান লক্ষণ এবং উপসর্গগুলি কি কি?'}"
Others data - Sheet1.docx,2517,বুলিমিয়া নারভোসা (ইটিং ডিসঅর্ডার) এর প্রধান কারণগুলি,বুলিমিয়া নারভোসা (ইটিং ডিসঅর্ডার) এর প্রধান কারণগুলি কি কি?,"{'fname': 'Others data - Sheet1.docx', 'id': 2517, 'context': 'বুলিমিয়া নারভোসা (ইটিং ডিসঅর্ডার) এর প্রধান কারণগুলি', 'question': 'বুলিমিয়া নারভোসা (ইটিং ডিসঅর্ডার) এর প্রধান কারণগুলি কি কি?'}"
Others data - Sheet1.docx,2518,বুলিমিয়া নারভোসা (ইটিং ডিসঅর্ডার)   নির্ণয় এবং চিকিৎসা,বুলিমিয়া নারভোসা (ইটিং ডিসঅর্ডার)    কিভাবে নির্ণয় এবং চিকিৎসা করা হয়?,"{'fname': 'Others data - Sheet1.docx', 'id': 2518, 'context': 'বুলিমিয়া নারভোসা (ইটিং ডিসঅর্ডার)   নির্ণয় এবং চিকিৎসা', 'question': 'বুলিমিয়া নারভোসা (ইটিং ডিসঅর্ডার)    কিভাবে নির্ণয় এবং চিকিৎসা করা হয়?'}"
Others data - Sheet1.docx,2519,মস্তিষ্কের সংক্রমণ,মস্তিষ্কের সংক্রমণ কি?,"{'fname': 'Others data - Sheet1.docx', 'id': 2519, 'context': 'মস্তিষ্কের সংক্রমণ', 'question': 'মস্তিষ্কের সংক্রমণ কি?'}"
Others data - Sheet1.docx,2520,মস্তিষ্কের সংক্রমণ এর প্রধান লক্ষণগুলি এবং উপসর্গগুলি,মস্তিষ্কের সংক্রমণ এর সঙ্গে জড়িত প্রধান লক্ষণগুলি এবং উপসর্গগুলি কি?,"{'fname': 'Others data - Sheet1.docx', 'id': 2520, 'context': 'মস্তিষ্কের সংক্রমণ এর প্রধান লক্ষণগুলি এবং উপসর্গগুলি', 'question': 'মস্তিষ্কের সংক্রমণ এর সঙ্গে জড়িত প্রধান লক্ষণগুলি এবং উপসর্গগুলি কি?'}"
Others data - Sheet1.docx,2521,মস্তিষ্কের সংক্রমণ এর প্রধান কারণ,মস্তিষ্কের সংক্রমণ এর প্রধান কারণ কি?,"{'fname': 'Others data - Sheet1.docx', 'id': 2521, 'context': 'মস্তিষ্কের সংক্রমণ এর প্রধান কারণ', 'question': 'মস্তিষ্কের সংক্রমণ এর প্রধান কারণ কি?'}"
Others data - Sheet1.docx,2522,মস্তিষ্কের সংক্রমণ নির্ণয় এবং চিকিৎসা,কিভাবে মস্তিষ্কের সংক্রমণ  নির্ণয় এবং চিকিৎসা করা যায়?,"{'fname': 'Others data - Sheet1.docx', 'id': 2522, 'context': 'মস্তিষ্কের সংক্রমণ নির্ণয় এবং চিকিৎসা', 'question': 'কিভাবে মস্তিষ্কের সংক্রমণ  নির্ণয় এবং চিকিৎসা করা যায়?'}"
Others data - Sheet1.docx,2523,মস্তিষ্কে আঘাত,মস্তিষ্কে আঘাত কি?,"{'fname': 'Others data - Sheet1.docx', 'id': 2523, 'context': 'মস্তিষ্কে আঘাত', 'question': 'মস্তিষ্কে আঘাত কি?'}"
Others data - Sheet1.docx,2524,মস্তিষ্কের সংক্রমণ এর প্রধান লক্ষণ এবং উপসর্গগুলি,মস্তিষ্কের সংক্রমণ  এর প্রধান লক্ষণ এবং উপসর্গগুলি কি কি?,"{'fname': 'Others data - Sheet1.docx', 'id': 2524, 'context': 'মস্তিষ্কের সংক্রমণ এর প্রধান লক্ষণ এবং উপসর্গগুলি', 'question': 'মস্তিষ্কের সংক্রমণ  এর প্রধান লক্ষণ এবং উপসর্গগুলি কি কি?'}"
Others data - Sheet1.docx,2525,মস্তিষ্কের সংক্রমণ প্রধান কারণ,মস্তিষ্কের সংক্রমণ প্রধান কারণ কি?,"{'fname': 'Others data - Sheet1.docx', 'id': 2525, 'context': 'মস্তিষ্কের সংক্রমণ প্রধান কারণ', 'question': 'মস্তিষ্কের সংক্রমণ প্রধান কারণ কি?'}"
Others data - Sheet1.docx,2526,মস্তিষ্কের সংক্রমণ   নির্ণয় এবং চিকিৎসা,মস্তিষ্কের সংক্রমণ এটা নির্ণয় এবং চিকিৎসা করা হয়?,"{'fname': 'Others data - Sheet1.docx', 'id': 2526, 'context': 'মস্তিষ্কের সংক্রমণ   নির্ণয় এবং চিকিৎসা', 'question': 'মস্তিষ্কের সংক্রমণ এটা নির্ণয় এবং চিকিৎসা করা হয়?'}"
Others data - Sheet1.docx,2527,ব্রেন হ্যামারেজ,ব্রেন হ্যামারেজ কি?,"{'fname': 'Others data - Sheet1.docx', 'id': 2527, 'context': 'ব্রেন হ্যামারেজ', 'question': 'ব্রেন হ্যামারেজ কি?'}"
Others data - Sheet1.docx,2528,ব্রেন হ্যামারেজ প্রধান লক্ষণগুলি এবং উপসর্গগুলি,ব্রেন হ্যামারেজ প্রধান লক্ষণগুলি এবং উপসর্গগুলি কি?,"{'fname': 'Others data - Sheet1.docx', 'id': 2528, 'context': 'ব্রেন হ্যামারেজ প্রধান লক্ষণগুলি এবং উপসর্গগুলি', 'question': 'ব্রেন হ্যামারেজ প্রধান লক্ষণগুলি এবং উপসর্গগুলি কি?'}"
Others data - Sheet1.docx,2529,ব্রেন হ্যামারেজ এর প্রধান কারণ,ব্রেন হ্যামারেজ এর প্রধান কারণ কি?,"{'fname': 'Others data - Sheet1.docx', 'id': 2529, 'context': 'ব্রেন হ্যামারেজ এর প্রধান কারণ', 'question': 'ব্রেন হ্যামারেজ এর প্রধান কারণ কি?'}"
Others data - Sheet1.docx,2530,ব্রেন হ্যামারেজ চিকিৎসা,কিভাবে ব্রেন হ্যামারেজ এটি ধরা এবং চিকিৎসা করা যায়?,"{'fname': 'Others data - Sheet1.docx', 'id': 2530, 'context': 'ব্রেন হ্যামারেজ চিকিৎসা', 'question': 'কিভাবে ব্রেন হ্যামারেজ এটি ধরা এবং চিকিৎসা করা যায়?'}"
Others data - Sheet1.docx,2531,ব্রেন ক্যান্সার,ব্রেন ক্যান্সার কি?,"{'fname': 'Others data - Sheet1.docx', 'id': 2531, 'context': 'ব্রেন ক্যান্সার', 'question': 'ব্রেন ক্যান্সার কি?'}"
Others data - Sheet1.docx,2532,ব্রেন ক্যান্সার প্রধান লক্ষণগুলি এবং উপসর্গগুলি,ব্রেন ক্যান্সার  প্রধান  লক্ষণগুলি এবং উপসর্গগুলি কি?,"{'fname': 'Others data - Sheet1.docx', 'id': 2532, 'context': 'ব্রেন ক্যান্সার প্রধান লক্ষণগুলি এবং উপসর্গগুলি', 'question': 'ব্রেন ক্যান্সার  প্রধান  লক্ষণগুলি এবং উপসর্গগুলি কি?'}"
Others data - Sheet1.docx,2533,ব্রেন ক্যান্সারের প্রধান কারণগুলি,ব্রেন ক্যান্সারের প্রধান কারণগুলি কি কি?,"{'fname': 'Others data - Sheet1.docx', 'id': 2533, 'context': 'ব্রেন ক্যান্সারের প্রধান কারণগুলি', 'question': 'ব্রেন ক্যান্সারের প্রধান কারণগুলি কি কি?'}"
Others data - Sheet1.docx,2534,ব্রেন ক্যান্সার নির্ণয় এবং চিকিৎসা,কিভাবে ব্রেন ক্যান্সার নির্ণয় এবং চিকিৎসা করা হয়?,"{'fname': 'Others data - Sheet1.docx', 'id': 2534, 'context': 'ব্রেন ক্যান্সার নির্ণয় এবং চিকিৎসা', 'question': 'কিভাবে ব্রেন ক্যান্সার নির্ণয় এবং চিকিৎসা করা হয়?'}"
Others data - Sheet1.docx,2535,শরীরে ব্যথা (গায়ে ব্যথা),শরীরে ব্যথা (গায়ে ব্যথা) কি?,"{'fname': 'Others data - Sheet1.docx', 'id': 2535, 'context': 'শরীরে ব্যথা (গায়ে ব্যথা)', 'question': 'শরীরে ব্যথা (গায়ে ব্যথা) কি?'}"
Others data - Sheet1.docx,2536,শরীরে ব্যথা (গায়ে ব্যথা) র লক্ষণ,শরীরে ব্যথা (গায়ে ব্যথা) এর সঙ্গে যুক্ত প্রধান লক্ষণ এবং উপসর্গগুলো কি কি?,"{'fname': 'Others data - Sheet1.docx', 'id': 2536, 'context': 'শরীরে ব্যথা (গায়ে ব্যথা) র লক্ষণ', 'question': 'শরীরে ব্যথা (গায়ে ব্যথা) এর সঙ্গে যুক্ত প্রধান লক্ষণ এবং উপসর্গগুলো কি কি?'}"
Others data - Sheet1.docx,2537,শরীরে ব্যথা (গায়ে ব্যথা) এর প্রধান কারণগুলো,শরীরে ব্যথা (গায়ে ব্যথা) এর প্রধান কারণগুলো কি কি?,"{'fname': 'Others data - Sheet1.docx', 'id': 2537, 'context': 'শরীরে ব্যথা (গায়ে ব্যথা) এর প্রধান কারণগুলো', 'question': 'শরীরে ব্যথা (গায়ে ব্যথা) এর প্রধান কারণগুলো কি কি?'}"
Others data - Sheet1.docx,2538,শরীরে ব্যথা (গায়ে ব্যথা)   নির্ণয় এবং চিকিৎসা,শরীরে ব্যথা (গায়ে ব্যথা)   কিভাবে নির্ণয় এবং চিকিৎসা করা হয়?,"{'fname': 'Others data - Sheet1.docx', 'id': 2538, 'context': 'শরীরে ব্যথা (গায়ে ব্যথা)   নির্ণয় এবং চিকিৎসা', 'question': 'শরীরে ব্যথা (গায়ে ব্যথা)   কিভাবে নির্ণয় এবং চিকিৎসা করা হয়?'}"
Others data - Sheet1.docx,2539,শরীরে ব্যথা (গায়ে ব্যথা) কিভাবে নির্ণয় এবং চিকিৎসা,শরীরে ব্যথা (গায়ে ব্যথা)   কিভাবে নির্ণয় এবং চিকিৎসা র প্রধান লক্ষণ এবং উপসর্গগুলি কি কি?,"{'fname': 'Others data - Sheet1.docx', 'id': 2539, 'context': 'শরীরে ব্যথা (গায়ে ব্যথা) কিভাবে নির্ণয় এবং চিকিৎসা', 'question': 'শরীরে ব্যথা (গায়ে ব্যথা)   কিভাবে নির্ণয় এবং চিকিৎসা র প্রধান লক্ষণ এবং উপসর্গগুলি কি কি?'}"
Others data - Sheet1.docx,2540,ফোস্কার প্রধান কারণগুলি,ফোস্কার প্রধান কারণগুলি কি কি ?,"{'fname': 'Others data - Sheet1.docx', 'id': 2540, 'context': 'ফোস্কার প্রধান কারণগুলি', 'question': 'ফোস্কার প্রধান কারণগুলি কি কি ?'}"
Others data - Sheet1.docx,2541,ফোস্কা নির্ণয় এবং   চিকিৎসা,কিভাবে ফোস্কা নির্ণয় এবং এর চিকিৎসা করা হয়?,"{'fname': 'Others data - Sheet1.docx', 'id': 2541, 'context': 'ফোস্কা নির্ণয় এবং   চিকিৎসা', 'question': 'কিভাবে ফোস্কা নির্ণয় এবং এর চিকিৎসা করা হয়?'}"
Others data - Sheet1.docx,2542,ব্লাডার ইনফেকসন বা মূত্রথলির সংক্রমণ,ব্লাডার ইনফেকসন বা মূত্রথলির সংক্রমণ কাকে বলে?,"{'fname': 'Others data - Sheet1.docx', 'id': 2542, 'context': 'ব্লাডার ইনফেকসন বা মূত্রথলির সংক্রমণ', 'question': 'ব্লাডার ইনফেকসন বা মূত্রথলির সংক্রমণ কাকে বলে?'}"
Others data - Sheet1.docx,2543,ব্লাডার ইনফেকসন বা মূত্রথলির সংক্রমণ এর প্রধান লক্ষণ ও উপসর্গগুলি,ব্লাডার ইনফেকসন বা মূত্রথলির সংক্রমণ এর প্রধান লক্ষণ ও উপসর্গগুলি কি কি?,"{'fname': 'Others data - Sheet1.docx', 'id': 2543, 'context': 'ব্লাডার ইনফেকসন বা মূত্রথলির সংক্রমণ এর প্রধান লক্ষণ ও উপসর্গগুলি', 'question': 'ব্লাডার ইনফেকসন বা মূত্রথলির সংক্রমণ এর প্রধান লক্ষণ ও উপসর্গগুলি কি কি?'}"
Others data - Sheet1.docx,2544,ব্লাডার ইনফেকসন বা মূত্রথলির সংক্রমণ এর প্রধান কারণগুলি,ব্লাডার ইনফেকসন বা মূত্রথলির সংক্রমণ এর   প্রধান কারণগুলি কি কি?,"{'fname': 'Others data - Sheet1.docx', 'id': 2544, 'context': 'ব্লাডার ইনফেকসন বা মূত্রথলির সংক্রমণ এর প্রধান কারণগুলি', 'question': 'ব্লাডার ইনফেকসন বা মূত্রথলির সংক্রমণ এর   প্রধান কারণগুলি কি কি?'}"
Others data - Sheet1.docx,2545,ব্লাডার ইনফেকসন বা মূত্রথলির সংক্রমণ রোগ নির্ণয় ও চিকিৎসা,ব্লাডার ইনফেকসন বা মূত্রথলির সংক্রমণ   রোগ নির্ণয় ও চিকিৎসা কিভাবে করা হয়?,"{'fname': 'Others data - Sheet1.docx', 'id': 2545, 'context': 'ব্লাডার ইনফেকসন বা মূত্রথলির সংক্রমণ রোগ নির্ণয় ও চিকিৎসা', 'question': 'ব্লাডার ইনফেকসন বা মূত্রথলির সংক্রমণ   রোগ নির্ণয় ও চিকিৎসা কিভাবে করা হয়?'}"
Others data - Sheet1.docx,2546,ব্লাডার ক্যান্সার বা মূত্রথলির ক্যান্সার,ব্লাডার ক্যান্সার বা মূত্রথলির ক্যান্সার কাকে বলে?,"{'fname': 'Others data - Sheet1.docx', 'id': 2546, 'context': 'ব্লাডার ক্যান্সার বা মূত্রথলির ক্যান্সার', 'question': 'ব্লাডার ক্যান্সার বা মূত্রথলির ক্যান্সার কাকে বলে?'}"
Others data - Sheet1.docx,2547,ব্লাডার ক্যান্সার বা মূত্রথলির ক্যান্সার এর প্রধান লক্ষণ ও উপসর্গগুলি,ব্লাডার ক্যান্সার বা মূত্রথলির ক্যান্সার এর প্রধান লক্ষণ ও উপসর্গগুলি কি কি?,"{'fname': 'Others data - Sheet1.docx', 'id': 2547, 'context': 'ব্লাডার ক্যান্সার বা মূত্রথলির ক্যান্সার এর প্রধান লক্ষণ ও উপসর্গগুলি', 'question': 'ব্লাডার ক্যান্সার বা মূত্রথলির ক্যান্সার এর প্রধান লক্ষণ ও উপসর্গগুলি কি কি?'}"
Others data - Sheet1.docx,2548,ব্লাডার ক্যান্সার বা মূত্রথলির ক্যান্সার প্রধান কারণগুলি,ব্লাডার ক্যান্সার বা মূত্রথলির ক্যান্সার প্রধান কারণগুলি কি কি?,"{'fname': 'Others data - Sheet1.docx', 'id': 2548, 'context': 'ব্লাডার ক্যান্সার বা মূত্রথলির ক্যান্সার প্রধান কারণগুলি', 'question': 'ব্লাডার ক্যান্সার বা মূত্রথলির ক্যান্সার প্রধান কারণগুলি কি কি?'}"
Others data - Sheet1.docx,2549,ব্লাডার ক্যান্সার বা মূত্রথলির ক্যান্সার রোগ নির্ণয় ও চিকিৎসা,ব্লাডার ক্যান্সার বা মূত্রথলির ক্যান্সার   রোগ নির্ণয় ও চিকিৎসা কিভাবে হয়?,"{'fname': 'Others data - Sheet1.docx', 'id': 2549, 'context': 'ব্লাডার ক্যান্সার বা মূত্রথলির ক্যান্সার রোগ নির্ণয় ও চিকিৎসা', 'question': 'ব্লাডার ক্যান্সার বা মূত্রথলির ক্যান্সার   রোগ নির্ণয় ও চিকিৎসা কিভাবে হয়?'}"
Others data - Sheet1.docx,2550,বেলস পালসি (ফেসিয়াল নার্ভ প্যারালাইসিস),বেলস পালসি (ফেসিয়াল নার্ভ প্যারালাইসিস) কি?,"{'fname': 'Others data - Sheet1.docx', 'id': 2550, 'context': 'বেলস পালসি (ফেসিয়াল নার্ভ প্যারালাইসিস)', 'question': 'বেলস পালসি (ফেসিয়াল নার্ভ প্যারালাইসিস) কি?'}"
Others data - Sheet1.docx,2551,বেলস পালসি (ফেসিয়াল নার্ভ প্যারালাইসিস)র প্রধান লক্ষণ এবং উপসর্গগুলি,বেলস পালসি (ফেসিয়াল নার্ভ প্যারালাইসিস)র প্রধান লক্ষণ এবং উপসর্গগুলি কি?,"{'fname': 'Others data - Sheet1.docx', 'id': 2551, 'context': 'বেলস পালসি (ফেসিয়াল নার্ভ প্যারালাইসিস)র প্রধান লক্ষণ এবং উপসর্গগুলি', 'question': 'বেলস পালসি (ফেসিয়াল নার্ভ প্যারালাইসিস)র প্রধান লক্ষণ এবং উপসর্গগুলি কি?'}"
